{
  "schema_version": "manual-entry-draft/1.2",
  "draft_id": "11111111-1111-4111-8111-111111111111",
  "status": "draft",
  "created_by": "synthetic-fixture",
  "created_at": "2026-06-01T08:00:00+00:00",
  "updated_at": "2026-06-01T08:03:00+00:00",
  "passport": {
    "project_name": "Synthetic equivalence project",
    "series_name": "Synthetic Excel-manual equivalence",
    "test_name": "EQ-01",
    "archive_number": "EQ-01",
    "test_date": "2026-06-01",
    "operator": "synthetic-fixture",
    "laboratory_or_site": "synthetic laboratory",
    "test_scope": "laboratory",
    "protocol_type": "static_step",
    "group_name": "baseline",
    "is_reinforced": false,
    "baseline_group": "baseline",
    "pair_id": "ACC-EQ-PAIR",
    "soil_type": "synthetic fine sand",
    "soil_batch": "SYNTH-SAND-EQ",
    "reinforcement_type": "none",
    "stamp_shape": "circle",
    "stamp_diameter_mm": "300",
    "stamp_area_m2": null,
    "load_kind": "force",
    "load_unit": "kN",
    "load_factor": "1",
    "load_zero": "0",
    "lever_ratio": "1",
    "settlement_unit": "mm",
    "number_of_indicators": 1,
    "indicator_passports": {
      "indicator_1": {
        "type": "synthetic dial indicator",
        "serial_number": "SYN-EQ-01",
        "instrument_id": "IND-ACC-EQ-01",
        "range_mm": "10",
        "division_mm": "0,01",
        "correction_factor": "1",
        "mode": "increasing_wrapped",
        "initial_reading": "9,80",
        "initial_turn": 0,
        "zero_correction_mm": "0",
        "max_increment_mm": "2",
        "reverse_tolerance_mm": "0,02",
        "travel_range_mm": "50",
        "verification_date": "2026-01-15",
        "verification_valid_until": "2030-01-15",
        "x_mm": "0",
        "y_mm": "0",
        "cumulative_sign": "1",
        "assignment_status": "confirmed"
      },
      "indicator_2": null,
      "indicator_3": null,
      "indicator_4": null,
      "reference_indicator": null
    },
    "legacy_common_indicator_passport": null,
    "settlement_aggregation": "primary_channel",
    "settlement_aggregation_channels": ["indicator_1"],
    "settlement_primary_channel": "indicator_1",
    "settlement_missing_channel_policy": "block",
    "metrology_status": "confirmed",
    "comment": "Synthetic decimal-comma source for semantic equivalence only.",
    "reinforcement": {
      "material": "",
      "number_of_layers": null,
      "depth_mm": null,
      "spacing_mm": null,
      "length_mm": null,
      "width_mm": null,
      "bar_diameter_or_aperture_mm": null,
      "orientation": "",
      "custom_parameters": {}
    }
  },
  "rows": [
    {
      "manual_row_uuid": "aaaaaaaa-aaaa-4aaa-8aaa-aaaaaaaaaaa1",
      "sequence_no": 1,
      "stage_no": "0",
      "branch": "loading",
      "elapsed_time_s": "0",
      "timestamp": "2026-06-01T08:00:00+00:00",
      "load_raw": "0,0",
      "indicator_1_raw": "9,80",
      "indicator_2_raw": null,
      "indicator_3_raw": null,
      "indicator_4_raw": null,
      "row_status": "measurement",
      "comment": "point 0",
      "source_type": "manual",
      "source_row": null,
      "created_by": "synthetic-fixture",
      "created_at": "2026-06-01T08:00:00+00:00",
      "modified_by": "synthetic-fixture",
      "modified_at": "2026-06-01T08:00:00+00:00"
    },
    {
      "manual_row_uuid": "aaaaaaaa-aaaa-4aaa-8aaa-aaaaaaaaaaa2",
      "sequence_no": 2,
      "stage_no": "1",
      "branch": "loading",
      "elapsed_time_s": "60",
      "timestamp": "2026-06-01T08:01:00+00:00",
      "load_raw": "1,0",
      "indicator_1_raw": "0,20",
      "indicator_2_raw": null,
      "indicator_3_raw": null,
      "indicator_4_raw": null,
      "row_status": "measurement",
      "comment": "point 1",
      "source_type": "manual",
      "source_row": null,
      "created_by": "synthetic-fixture",
      "created_at": "2026-06-01T08:01:00+00:00",
      "modified_by": "synthetic-fixture",
      "modified_at": "2026-06-01T08:01:00+00:00"
    },
    {
      "manual_row_uuid": "aaaaaaaa-aaaa-4aaa-8aaa-aaaaaaaaaaa3",
      "sequence_no": 3,
      "stage_no": "2",
      "branch": "loading",
      "elapsed_time_s": "120",
      "timestamp": "2026-06-01T08:02:00+00:00",
      "load_raw": "2,0",
      "indicator_1_raw": "0,70",
      "indicator_2_raw": null,
      "indicator_3_raw": null,
      "indicator_4_raw": null,
      "row_status": "measurement",
      "comment": "point 2",
      "source_type": "manual",
      "source_row": null,
      "created_by": "synthetic-fixture",
      "created_at": "2026-06-01T08:02:00+00:00",
      "modified_by": "synthetic-fixture",
      "modified_at": "2026-06-01T08:02:00+00:00"
    }
  ],
  "audit_events": [
    {
      "event_id": "bbbbbbbb-bbbb-4bbb-8bbb-bbbbbbbbbbbb",
      "author": "synthetic-fixture",
      "timestamp": "2026-06-01T08:03:00+00:00",
      "action": "create_acceptance_fixture",
      "entity_id": "11111111-1111-4111-8111-111111111111",
      "field": null,
      "old_value": null,
      "new_value": {"rows": 3, "source_type": "manual"},
      "reason": "synthetic_equivalence_fixture"
    }
  ]
}
